title,description,published date,url,source,news_website_url,full_article
Explained | Daily limit on UPI transactions - The Hindu,Explained | Daily limit on UPI transactions  The Hindu,"Sun, 11 Jun 2023 07:00:00 GMT",https://consent.google.com/m?continue=https://news.google.com/rss/articles/CBMiX2h0dHBzOi8vd3d3LnRoZWhpbmR1LmNvbS9idXNpbmVzcy9leHBsYWluZWQtZGFpbHktbGltaXQtb24tdXBpLXRyYW5zYWN0aW9ucy9hcnRpY2xlNjY5NDc3ODMuZWNl0gFkaHR0cHM6Ly93d3cudGhlaGluZHUuY29tL2J1c2luZXNzL2V4cGxhaW5lZC1kYWlseS1saW1pdC1vbi11cGktdHJhbnNhY3Rpb25zL2FydGljbGU2Njk0Nzc4My5lY2UvYW1wLw?oc%3D5&gl=FR&m=0&pc=n&cm=2&hl=en-US&src=1,The Hindu,https://www.thehindu.com,"June 09, 2023 04:30 am | Updated June 11, 2023 12:53 pm IST

The story so far:

As transactions facilitated by the Unified Payments Interface (UPI) breach record highs, banks have opted for daily limits. These are over and above the already imposed ceilings mandated by the facilitator, the National Payments Corporation of India (NPCI), in 2021. The idea is to sustain the smoother functioning of the payments interface as it continues to acquire popularity.

What is the conversation about daily limits?

At present, users can make up to 20 transactions or ₹1 lakh in a single day — either all at once or through the day. For certain specific categories of transactions such as the capital markets, collections (such as bills, among others), insurance and forward inward remittances, the limit is ₹2 lakh. In December 2021, the limit for the UPI-based ASBA (Application Supported by Blocked Amount) IPO and retail direct schemes was increased to ₹5 lakh for each transaction.

Also Read | Google Pay enables Aadhaar-based authentication for UPI activation

The conversation now revolves around banks and apps coming up with their own guidelines for transactions. For example, state-run lenders Punjab National Bank (PNB) and Bank of Baroda has set its transaction limit at a much lower ₹25,000. PNB’s daily limit is ₹50,000. As for apps, among others, Google Pay users breach the daily limit if they try to send money more than ten times in a single day across all UPI apps.

As the payments interface looks to expand its footprint (recall the boarding of non-resident accounts having international numbers into the ecosystem) and its growing utility in daily lives, limits would help maintain an essential security infrastructure and its seamless functioning. This is also important as the interface looks to expand its use-case, as also called for in the proposed pilot project for coin-vending machines with UPI as the facilitator.

What does the industry think?

Digital payments app PhonePe’s spokesperson told The Hindu, “The limits are set balancing out customer convenience and potential fraud/risk concerns. The NPCI has also increased the value limit in specific categories where the average transaction value is higher such as Capital Markets or Credit Card Bill payments.”

Explained | Will consumers now have to pay for transactions made with PPIs via UPI?

As for the moves impacting the future growth, “All the ecosystem participants, the NPCI and the regulator regularly review the transaction and value limits on UPI and implement the requisite changes where the need exists”, the official said referring to the higher limits for IPOs, broking, mutual funds, loan repayment etc.

What are the most recent trends observed with respect to UPI?

In May this year, the total number of transactions facilitated using UPI increased to 9,415.19 million. The combined value of such transactions also increased at a largely similar ₹14.89 lakh crore. The segregation in terms of P2P (peer-to-peer) and P2M (peer-to-merchant) is particularly interesting. In terms of volume, whilst P2P accounted for about 43% at 4,045.48 million, in terms of value its share scaled up to ₹11.45 lakh crore.

Explained | India’s UPI push

In the P2P category, the majority of the transactions were in the below ₹500 bracket (54.2%) whilst in the P2M category, the share in the same amount bracket stood at 84.3%. This gives an indication of its lower-down utility. Important to note that considering the varied nature of merchants and business, the nature of transactions can be categorised in favour of one whilst it should be on the other side.

However, important to note in this context, until February in the financial year 2022-23, the total number of reported UPI frauds had also increased about 13% in comparison to the previous financial year to 95,402. However, this was alongside a decline in the fraud to sales ratio at 0.0015%.

Thus, to combat the growing incidences, there is the imperative need to have safeguard infrastructure in a growing ecosystem."
Mint Explainer: How does America’s FedNow stack up against India’s UPI? | Mint - Mint,Mint Explainer: How does America’s FedNow stack up against India’s UPI? | Mint  Mint,"Fri, 28 Jul 2023 07:00:00 GMT",https://consent.google.com/m?continue=https://news.google.com/rss/articles/CBMihwFodHRwczovL3d3dy5saXZlbWludC5jb20vb3Bpbmlvbi9vbmxpbmUtdmlld3MvbWludC1leHBsYWluZXItaG93LWRvZXMtYW1lcmljYS1zLWZlZG5vdy1zdGFjay11cC1hZ2FpbnN0LWluZGlhLXMtdXBpLTExNjkwNTI5MTAwOTM5Lmh0bWzSAYsBaHR0cHM6Ly93d3cubGl2ZW1pbnQuY29tL29waW5pb24vb25saW5lLXZpZXdzL21pbnQtZXhwbGFpbmVyLWhvdy1kb2VzLWFtZXJpY2Etcy1mZWRub3ctc3RhY2stdXAtYWdhaW5zdC1pbmRpYS1zLXVwaS9hbXAtMTE2OTA1MjkxMDA5MzkuaHRtbA?oc%3D5&gl=FR&m=0&pc=n&cm=2&hl=en-US&src=1,Mint,https://www.livemint.com,"On 21 July the United States Federal Reserve started rolling out its long-awaited ‘instant’ payment system, FedNow. FedNow, which has been in the works for the past four years, offers users a simple and convenient way to send and receive payments. It has clear similarities with India’s Unified Payments Interface (UPI) infrastructure, but there are several differences between the two systems. Mint explains how they differ.

How does FedNow work, and how does it differ from UPI?

FedNow, run by the US Federal Reserve, is actually closer to India’s Real-Time Gross Settlement (RTGS) system than UPI. Unlike UPI, FedNow does not use unique virtual addresses or a user’s phone number as the primary identifier. Instead, users need to login to their internet banking service and use their bank account number as well as a ‘routing number’ to make a real-time payment. The system, which will be online 24-hours a day round the year, will notify the US federal ledger in real time about payments and transfers made between users and merchants.

UPI, on the other hand, is operated by a non-government, non-profit entity, the National Payments Corporation of India (NPCI). It comprises a set of application programming interface (API) – pieces of code – that apps can tap into for instant payments.

Which of the two is cheaper and safer?

It is too early to gauge how safe FedNow will be — the early-stage rollout began only last week. However, it is significantly more expensive than UPI. Users will have to pay a $25 (about ₹2,000) participation fee, $0.045 (about ₹3.7) per credit transfer (to be paid by the sender), and $0.01 for each request-for-payment message (to be paid by the requestor)

In comparison, UPI has so far been certified as a ‘digital public good’ and has zero transaction fees. According to a Forbes report from 24 July, the US Federal Reserve positioning FedNow as a premium service and not as a public utility.

Can FedNow achieve UPI’s popularity even as a paid service?

UPI has been an unequivocal success since its rollout in April 2016. It clocked over 9.3 billion transactions worth ₹14.7 trillion last month, according to NPCI data.

FedNow, according to media reports, is presently available to customers of only 25 banks and credit unions. Last month, the US Federal Reserve said JP Morgan Chase, Wells Fargo, US Bancorp and other top banks have joined the network. However, until it is more widely available, it will be only partially usable since both the sender and receiver need to be customers of a participating bank.

Will FedNow become ubiquitous like UPI? Many exports think not. Eric McCune, expert partner at Bain & Co, told Forbes that adoption will “significantly vary by use case"", holding up as an example the real-time payment clearance service of The Clearing House, private firm.

A 2023 US banking report by financial consultant Cornerstone Advisors US banking report highlighted that real-time payments remain a premium service in the US, offered by less than half of all banks. In comparison, UPI is available to anyone with a bank account.

Media reports have also said that FedNow’s adoption is likely to be driven by enterprises, which means that the service could end up being used primarily by businesses to clear payments more quickly. In comparison, peer-to-peer (P2P) payments make up a huge chunk of UPI transactions – they accounted for 77% of the ₹14.7 trillion in transaction value recorded last month."
"PPRO Signs Strategic Partnership With NPCI International, Unlocking Simplified Access to India’s UPI Payment System for Cross-Border Transactions - Yahoo Finance","PPRO Signs Strategic Partnership With NPCI International, Unlocking Simplified Access to India’s UPI Payment System for Cross-Border Transactions  Yahoo Finance","Wed, 26 Apr 2023 07:00:00 GMT",https://consent.google.com/m?continue=https://news.google.com/rss/articles/CBMiU2h0dHBzOi8vZmluYW5jZS55YWhvby5jb20vbmV3cy9wcHJvLXNpZ25zLXN0cmF0ZWdpYy1wYXJ0bmVyc2hpcC1ucGNpLTA0MDAwMDExNi5odG1s0gFbaHR0cHM6Ly9maW5hbmNlLnlhaG9vLmNvbS9hbXBodG1sL25ld3MvcHByby1zaWducy1zdHJhdGVnaWMtcGFydG5lcnNoaXAtbnBjaS0wNDAwMDAxMTYuaHRtbA?oc%3D5&gl=FR&m=0&pc=n&cm=2&hl=en-US&src=1,Yahoo Finance,https://finance.yahoo.com,"This partnership removes complexity and boosts efficiency for international PSPs and merchants wanting to sell cross-border into India at scale

LONDON & MUMBAI, India, April 27, 2023--(BUSINESS WIRE)--PPRO, the leading digital payments infrastructure provider, has signed a strategic agreement with NPCI International Payments Limited (NIPL) to offer global partners access to Unified Payments Interface (UPI), India’s fastest-growing, real-time payment system, for cross-border transactions. Today’s agreement, supported by a new framework co-developed with NIPL, paves the way for the first merchants to go live in the coming months.

By connecting directly to UPI via PPRO’s digital payments infrastructure, international payment service providers (PSPs) enable merchants to tap into India's huge online consumer base easily and securely, without the need for setting up a legal entity in India, settlement to an India-based bank or for uploading invoices to clear funds. For consumers, this means they can seamlessly make cross-border purchases in Indian Rupees using their favourite payment method.

Launched in 2016, UPI is India’s most popular instant payment system, already processing 60% of all domestic payments. It has over 325 million active users, supports 390 banks and 100 third-party apps within a single mobile application. In March 2023 alone, UPI processed over 8.7 billion transactions, the highest since its launch.

Simon Black, CEO at PPRO, said: ""International payment service providers and their merchants can now easily tap into an e-commerce market that is expected to reach an estimated $111 billion next year1, and predicted to almost double to $200 billion by 20262. By integrating UPI into PPRO’s digital payments infrastructure through a single connection, we have removed all the operational complexity for our partners to sell cross-border into India at scale.""

Ritesh Shukla, CEO at NIPL, said: ""UPI has revolutionised the digital payments landscape in India and is respected globally for its role in simplifying and democratising payments. By partnering with PPRO, a market leader in the payments infrastructure space, which powers a vast PSP and merchant network, Indian consumers will now be able to shop online with merchants around the world and pay safely and easily using UPI.""

Story continues

For further information, please click here.

-ENDS-

1 www.ibef.org/industry/ecommerce

2 www.ibef.org/industry/ecommerce

View source version on businesswire.com: https://www.businesswire.com/news/home/20230426005853/en/

Contacts

Media contact

Viali Munteanu

ppro@cognitomedia.com

+44 (0) 7547 819 438"
"Zomato starts own UPI offering, Flipkart to follow suit - The Economic Times","Zomato starts own UPI offering, Flipkart to follow suit  The Economic Times","Tue, 16 May 2023 07:00:00 GMT",https://consent.google.com/m?continue=https://news.google.com/rss/articles/CBMifGh0dHBzOi8vbS5lY29ub21pY3RpbWVzLmNvbS90ZWNoL3RlY2hub2xvZ3kvem9tYXRvLXN0YXJ0cy1vd24tdXBpLW9mZmVyaW5nLWZsaXBrYXJ0LXRvLWZvbGxvdy1zdWl0L2FydGljbGVzaG93LzEwMDI3MjQ1OC5jbXPSAYABaHR0cHM6Ly9tLmVjb25vbWljdGltZXMuY29tL3RlY2gvdGVjaG5vbG9neS96b21hdG8tc3RhcnRzLW93bi11cGktb2ZmZXJpbmctZmxpcGthcnQtdG8tZm9sbG93LXN1aXQvYW1wX2FydGljbGVzaG93LzEwMDI3MjQ1OC5jbXM?oc%3D5&gl=FR&m=0&pc=n&cm=2&hl=en-US&src=1,The Economic Times,https://m.economictimes.com,"It seems like you're already an ETPrime member with

Login using your ET Prime credentials to enjoy all member benefits

Log out of your current logged-in account and log in again using your ET Prime credentials to enjoy all member benefits."
