title,description,published date,url,source,news_website_url,full_article
Is India’s UPI Real-Time Payments System Ready To Go Global? - Forbes,Is India’s UPI Real-Time Payments System Ready To Go Global?  Forbes,"Mon, 10 Apr 2023 07:00:00 GMT",https://consent.google.com/m?continue=https://news.google.com/rss/articles/CBMicGh0dHBzOi8vd3d3LmZvcmJlcy5jb20vc2l0ZXMvemVubm9ua2Fwcm9uLzIwMjMvMDQvMTAvaXMtaW5kaWFzLXVwaS1yZWFsLXRpbWUtcGF5bWVudHMtc3lzdGVtLXJlYWR5LXRvLWdvLWdsb2JhbC_SAXRodHRwczovL3d3dy5mb3JiZXMuY29tL3NpdGVzL3plbm5vbmthcHJvbi8yMDIzLzA0LzEwL2lzLWluZGlhcy11cGktcmVhbC10aW1lLXBheW1lbnRzLXN5c3RlbS1yZWFkeS10by1nby1nbG9iYWwvYW1wLw?oc%3D5&gl=FR&m=0&pc=n&cm=2&hl=en-US&src=1,Forbes,https://www.forbes.com,
UPI-PayNow linked to ease payments with Singapore - The Hindu,UPI-PayNow linked to ease payments with Singapore  The Hindu,"Wed, 22 Feb 2023 08:00:00 GMT",https://consent.google.com/m?continue=https://news.google.com/rss/articles/CBMiZ2h0dHBzOi8vd3d3LnRoZWhpbmR1LmNvbS9idXNpbmVzcy9FY29ub215L2luZGlhLXNpbmdhcG9yZS1sYXVuY2gtdXBpLXBheW5vdy1saW5rYWdlL2FydGljbGU2NjUzNjk2MC5lY2XSAWxodHRwczovL3d3dy50aGVoaW5kdS5jb20vYnVzaW5lc3MvRWNvbm9teS9pbmRpYS1zaW5nYXBvcmUtbGF1bmNoLXVwaS1wYXlub3ctbGlua2FnZS9hcnRpY2xlNjY1MzY5NjAuZWNlL2FtcC8?oc%3D5&gl=FR&m=0&pc=n&cm=2&hl=en-US&src=1,The Hindu,https://www.thehindu.com,"February 22, 2023 12:30 am | Updated 08:42 pm IST - NEW DELHI

India’s Unified Payments Interface — better known as UPI — and Singapore’s PayNow were officially connected on Tuesday, allow for a “real-time payment linkage”. The virtual launch was led by a phone call between Prime Minister Narendra Modi and his Singaporean counterpart Lee Hsien Loong.

“Today is a special day for India-Singapore friendship and for our efforts to deepen collaboration in FinTech and innovaton. The participation of my friend PM Lee Sien Loong made this morning’s programme even more special,” Mr. Modi said. The linkage is set to ease financial transactions for the Indian diaspora.

Also read: RBI allows UPI-based transactions for inbound travellers to India

Singapore has now became the first country with which cross-border Person to Person (P2P) payment facilities have been launched. “This will help the Indian diaspora in Singapore, especially migrant workers/students and bring the benefits of digitalisation and FINTECH to the common man through instantaneous and low-cost transfer of money from Singapore to India and vice-versa,” said the Ministry of External Affairs. UPI payments through QR codes are already taking place in Singapore, though at a limited number of outlets.

“Delighted to launch the linkage between PayNow and India’s Unified Payments Interface (UPI) with PM Narendra Modi today. Congratulations to the Monetary Authority of Singapore, the Reserve Bank of India and all the stakeholders in Singapore and India who have helped make the linkage a reality,” Lee Hsien Loong said at the event.

Demonstrating the link, the Reserve Bank of India’s Governor Shaktikanta Das and the Monetary Authority of Singapore’s Managing Director Ravi Menon made live “cross-border transactions” to each other using their mobile handsets."
"India, Singapore link systems for real-time cross-border cash transfers - The Register","India, Singapore link systems for real-time cross-border cash transfers  The Register","Wed, 22 Feb 2023 08:00:00 GMT",https://consent.google.com/m?continue=https://news.google.com/rss/articles/CBMiR2h0dHBzOi8vd3d3LnRoZXJlZ2lzdGVyLmNvbS8yMDIzLzAyLzIyL3NpbmdhcG9yZV9pbmRpYV91cGlfcGF5bm93X2xpbmsv0gFLaHR0cHM6Ly93d3cudGhlcmVnaXN0ZXIuY29tL0FNUC8yMDIzLzAyLzIyL3NpbmdhcG9yZV9pbmRpYV91cGlfcGF5bm93X2xpbmsv?oc%3D5&gl=FR&m=0&pc=n&cm=2&hl=en-US&src=1,The Register,https://www.theregister.com,"India's use of government-created tech to expand its sphere of influence advanced yesterday, when Singapore agreed to link the Unified Payments Interface (UPI) to its own PayNow scheme – enabling real-time cross-border payments between the two nations.

UPI is a peer-to-peer or peer-to-merchant scheme that transfers money between bank accounts in real time. PayNow does likewise, using a mobile phone number as the identifier.

Both schemes were designed for use within their source nation's borders.

But yesterday Indian prime minister Narendra Modi and Singapore PM Lee Hsien Loong announced interoperability between the schemes, meaning residents in either country can make cross-border payments in real time – provided they hold accounts with participating banks.

News of the two schemes intertwining is about more than just convenience, or the boost to the nations' digital economies both leaderss enthused about at the launch.

The announcement is also a demonstration of India using government-developed software to extend its regional influence.

India created UPI to meet a domestic need for faster payments – and to bring more people out of the cash economy and within reach of tax authorities.

UPI operates at enormous scale – the scheme processed over eight billion transactions in January 2023 alone.

UPI is also an expression of India's belief in digital public goods – software that performs a useful function that India needs, and operates at sufficient scale that it represents a counterweight to commercial services that might otherwise dominate markets.

Open source software fills a similar role in other fields. Big software companies put energy into Linux to ensure commercial operating systems face robust competition so the likes of Microsoft can't accrue too much influence.

In July 2022 India bundled several of its digital public goods into a project called IndiaStack, which it offered to other governments free of charge.

IndiaStack is about building influence, according to Baani Grewal, an analyst at the Australian Strategic Policy Institute where she leads strategic engagement with South Asia and focuses on India.

""The Indian government wants to export a governance model that is separate from China, the EU, and the United States,"" she told The Register.

""And it helps India to have South Asian countries be part of its payment system, or to show that Europe or Australia are adopting India's digital models.""

Adoption of UPI abroad also plays well at home, Grewal said, as Indian travellers perceive their government having achieved widespread influence.

Other travellers can also get a taste of UPI. The scheme has previously required participants to hold a bank account in India, but early in February India's Reserve Bank announced that eligible visitors from G20 countries will be allowed to create ""Prepaid Payment Instruments"" – wallets linked to UPI for making payments at Indian merchants that accept the scheme.

The choice of G20 nations is no accident: India is the current chair of the bloc and will host many meetings, and many thousands of influential visitors, during the year. Many may go home with a positive UPI story to share.

The Singapore/India UPI deal may also mean that the Indian scheme's brand starts to appear at points of sale – just like Alibaba's AliPay has done around the world.

Singapore's status as a regional financial service hub will also give UPI a fine shop window.

Perhaps the bilateral deal may also make life a little harder for another cross-border payments contender: blockchain. After all, who needs to go through all the pain of building new payment systems, and reassuring users there's no taint from cryptocurrency and other fintech flops, when governments already have the systems to make cross-border money movements happen? ®"
"PM Modi, Singapore counterpart launch real-time payment systems linkage - Hindustan Times","PM Modi, Singapore counterpart launch real-time payment systems linkage  Hindustan Times","Tue, 21 Feb 2023 08:00:00 GMT",https://consent.google.com/m?continue=https://news.google.com/rss/articles/CBMihwFodHRwczovL3d3dy5oaW5kdXN0YW50aW1lcy5jb20vYnVzaW5lc3MvaW5kaWEtc2luZ2Fwb3JlLXBtcy10by13aXRuZXNzLXJlYWwtdGltZS1wYXltZW50LXN5c3RlbXMtbGlua2FnZS1vbi1mZWItMjEtMTAxNjc2ODk0MjU1NDQzLmh0bWzSAYsBaHR0cHM6Ly93d3cuaGluZHVzdGFudGltZXMuY29tL2J1c2luZXNzL2luZGlhLXNpbmdhcG9yZS1wbXMtdG8td2l0bmVzcy1yZWFsLXRpbWUtcGF5bWVudC1zeXN0ZW1zLWxpbmthZ2Utb24tZmViLTIxLTEwMTY3Njg5NDI1NTQ0My1hbXAuaHRtbA?oc%3D5&gl=FR&m=0&pc=n&cm=2&hl=en-US&src=1,Hindustan Times,https://www.hindustantimes.com,"We're now on WhatsApp. Click to join.

""Linkage of Unified Payments Interface (UPI) and PayNow is a new milestone in India-Singapore relations,"" PM Modi said, calling UPI “the most preferred payment mechanism” in India as “74 billion transactions amounting to more than ₹126 trillion were done through UPI in 2022.”

“Many experts are estimating that digital wallet transactions are going to soon overtake cash transactions,” PM Modi added.

Read more: ‘PM Modi stopped Ukraine War to evacuate 22,500 Indian students’: Nadda in Udupi

India has emerged as one of the fastest-growing ecosystems for fintech innovation. Prime Minister Modi’s visionary leadership has been instrumental in driving globalisation of India’s best-in-class digital payment infrastructure, union finance ministry said in a statement.

“A key emphasis of the Prime Minister has been on ensuring that the benefits of UPI are not limited to India only, but other countries too benefit from it,” it said.

The linkage of these two payment systems would enable residents of both countries in faster and cost-efficient transfer of cross-border remittances, it added, also helping the Indian diaspora in Singapore, especially migrant workers and students through instantaneous and low cost transfer of money from Singapore to India and vice-versa.

""Exciting news! Hindustan Times is now on WhatsApp Channels Subscribe today by clicking the link and stay updated with the latest news!"" Click here!

SHARE THIS ARTICLE ON

ABOUT THE AUTHOR HT News Desk Follow the latest breaking news and developments from India and around the world with Hindustan Times' newsdesk. From politics and policies to the economy and the environment, from local issues to national events and global affairs, we've got you covered. ...view detail

Topics

Pm Modi

Click to Top

Story Saved"
"India Embraces Digital Payments Over Cash, Even for a 10-Cent Chai - The New York Times","India Embraces Digital Payments Over Cash, Even for a 10-Cent Chai  The New York Times","Wed, 01 Mar 2023 08:00:00 GMT",https://consent.google.com/m?continue=https://news.google.com/rss/articles/CBMiS2h0dHBzOi8vd3d3Lm55dGltZXMuY29tLzIwMjMvMDMvMDEvYnVzaW5lc3MvaW5kaWEtZGlnaXRhbC1wYXltZW50cy11cGkuaHRtbNIBAA?oc%3D5&gl=FR&m=0&pc=n&cm=2&hl=en-US&src=1,The New York Times,https://www.nytimes.com,"The little QR code is ubiquitous across India’s vastness.

You find it pasted on a tree next to a roadside barber, propped on the pile of embroidery sold by female weavers, sticking out of a mound of freshly roasted peanuts on a snack cart. A beachside performer in Mumbai places it on his donations can before beginning his robot act; a Delhi beggar flashes it through your car’s window when you plead that you have no cash.

The codes connect hundreds of millions of people in an instant payment system that has revolutionized Indian commerce. Billions of mobile app transactions — a volume dwarfing anything in the West — course each month through a homegrown digital network that has made business easier and brought large numbers of Indians into the formal economy.

The scan-and-pay system is one pillar of what the country’s prime minister, Narendra Modi, has championed as “digital public infrastructure,” with a foundation laid by the government. It has made daily life more convenient, expanded banking services like credit and savings to millions more Indians, and extended the reach of government programs and tax collection."
Unified Payments Interface (UPI) market size in India to grow by USD 65.49 trillion from 2021 to 2026: Instant and smooth money transfer process will drive growth - Technavio - Yahoo Finance,Unified Payments Interface (UPI) market size in India to grow by USD 65.49 trillion from 2021 to 2026: Instant and smooth money transfer process will drive growth - Technavio  Yahoo Finance,"Tue, 08 Aug 2023 07:00:00 GMT",https://consent.google.com/m?continue=https://news.google.com/rss/articles/CBMiU2h0dHBzOi8vZmluYW5jZS55YWhvby5jb20vbmV3cy91bmlmaWVkLXBheW1lbnRzLWludGVyZmFjZS11cGktbWFya2V0LTA4MDAwMDcyNC5odG1s0gFbaHR0cHM6Ly9maW5hbmNlLnlhaG9vLmNvbS9hbXBodG1sL25ld3MvdW5pZmllZC1wYXltZW50cy1pbnRlcmZhY2UtdXBpLW1hcmtldC0wODAwMDA3MjQuaHRtbA?oc%3D5&gl=FR&m=0&pc=n&cm=2&hl=en-US&src=1,Yahoo Finance,https://finance.yahoo.com,"NEW YORK, Aug. 8, 2023 /PRNewswire/ -- The unified payments interface (UPI) market in India size is estimated to grow by USD 65.49 trillion from 2021 to 2026 at a CAGR of 132.98% according to Technavio. Download a sample report!

Technavio has announced its latest market research report titled Unified Payments Interface (UPI) Market in India

Unified payments interface (UPI) market in India insights -

Vendors : 15+, Including Alphabet Inc., Amazon.com Inc., Apple Inc., Axis Bank Ltd., Bank of Baroda, Bharti Airtel Ltd., Central Bank of India, Dreamplug Technologies Pvt. Ltd., HDFC Bank Ltd., ICICI Bank Ltd., Kotak Mahindra Bank Ltd., Meta Platforms Inc., One MobiKwik System Pvt. Ltd., One97 Communications Ltd., Reliance Industries Ltd., Samsung Electronics Co. Ltd., South Indian Bank Ltd., State Bank of India, Union Bank of India, Walmart Inc., and Yes Bank, among others

Coverage: Parent market analysis; key drivers, major trends, and challenges; customer and vendor landscape; vendor product insights and recent developments; key vendors; and market positioning of vendors

Segments: Application (Money transfers, Bill payments, Point of sale, and Others) and Type (P2P and P2M)

To understand more about the unified payments interface (UPI) market in India, request a sample report

Unified payments interface (UPI) market in India - Vendor Insights

The growing competition in the market is compelling vendors to adopt various growth strategies such as promotional activities and spending on advertisements to improve the visibility of their services. Technavio report analyzes the market's competitive landscape and offers information on several market vendors including Alphabet Inc., Amazon.com Inc., Apple Inc., Axis Bank Ltd., Bank of Baroda, Bharti Airtel Ltd., Central Bank of India, Dreamplug Technologies Pvt. Ltd., HDFC Bank Ltd., ICICI Bank Ltd., Kotak Mahindra Bank Ltd., Meta Platforms Inc., One MobiKwik System Pvt. Ltd., One97 Communications Ltd., Reliance Industries Ltd., Samsung Electronics Co. Ltd., South Indian Bank Ltd., State Bank of India, Union Bank of India, Walmart Inc., and Yes Bank

Story continues

Unified payments interface (UPI) market in India – Market Dynamics

Major Driver - Instant and smooth money transfer process

Instant and smooth money transfer process drives the growth of the UPI market in India. The UPI is based on the IMPS platform, in which, users have the flexibility to make the payment at any time and from anywhere.

Furthermore, along with having no restrictions on holidays and odd hours, bank strikes will also not affect the UPI payments. Users can instantly register and make instant fund transfer. Hence, such factors are expected to drive the growth of the UPI market in India during the forecast period.

Significant Trends - The growing emergence of mobile apps for shopping transactions

The growing emergence of mobile apps for shopping transactions is an emerging UPI market trend in India. When compared to websites, online shopping transactions are higher in mobile apps because of the increasing penetration of smart devices in the market. Furthermore, market vendors such as Google LLC, Paytm Payments Bank Limited, and Walmart Inc. offer mobile-based UPI apps. Some examples of UPI apps include GooglePay, PayTM, and PhonePe. Hence, trends like the growing emergence of mobile apps for shopping transactions are expected to drive the growth of the UPI market in India during the forecast period.

Key Challenges - UPI payment frauds

The UPI payment frauds challenge the growth of the UPI market in India. Misleading UPI handles, request money fraud, and phishing are some of the examples of UPI payment frauds that take place in the market.

For instance, in phishing, fraudsters send unauthorized links via emails or SMSs to the users, and once they click on such unauthorized links, the money gets transferred from their account to the fraudster's account. Hence, challenges such as fraud happening in the market can hamper the growth of the UPI market in India during the forecast period.

Drivers, Trends, and Challenges have an impact on market dynamics, which can impact businesses. Find more insights in a sample report!

The unified payments interface (UPI) market in India report provides critical information and factual data, with a qualitative and quantitative study of the market based on market drivers and limitations as well as future prospects.

Why Buy?

Add credibility to strategy

Analyzes competitor's offerings

Get a holistic view of the market

Grow your profit margin with Technavio- Buy the Report

What are the key data covered in this Unified payments interface (UPI) market in India report?

CAGR of the market during the forecast period

Detailed information on factors that will drive the growth of the unified payments interface (UPI) market in India between 2022 and 2026

Precise estimation of the size of the unified payments interface (UPI) market in India and its contribution to the market with a focus on the parent market

Accurate predictions about upcoming trends and changes in consumer behavior

Growth of the unified payments interface (UPI) market across India

A thorough analysis of the market's competitive landscape and detailed information about vendors

Comprehensive analysis of factors that will challenge the growth of the unified payments interface (UPI) market vendors in India

Gain instant access to 17,000+ market research reports.

Technavio's SUBSCRIPTION platform

Related Reports:

The Global Mobile Payments Market Size is estimated to grow by USD 75,412.89 million between 2022 and 2027 accelerating at a CAGR of 20.49%. This mobile payments market report extensively covers market segmentation by location (remote payment and proximity payment), type (money transfers, merchandise purchases, bill payments, and others), and geography (APAC, Europe, North America, South America, and Middle East and Africa). The rising number of online transactions is a major mobile payments market driver.

The payment processing solutions market size is estimated to grow at a CAGR of 12.18% between 2022 and 2027. The market size is forecast to increase by USD 63.48 billion. This payment processing solutions market report extensively covers market segmentation by deployment (cloud-based and on-premises), method (credit card, debit card, e-wallet, and others), and geography (North America, Europe, APAC, South America, and Middle East and Africa). The high adoption of contactless payment solutions is driving growth.

Unified payments interface (UPI) market Scope in India Report Coverage Details Base year 2021 Historic period 2017-2021 Forecast period 2022-2026 Growth momentum & CAGR Decelerate at a CAGR of 132.98% Market growth 2022-2026 USD 65.49 trillion Market structure Fragmented YoY growth 2022-2023 (%) 130.0 Competitive landscape Leading Vendors, Market Positioning of Vendors, Competitive Strategies, and Industry Risks Key companies profiled Alphabet Inc., Amazon.com Inc., Apple Inc., Axis Bank Ltd., Bank of Baroda, Bharti Airtel Ltd., Central Bank of India, Dreamplug Technologies Pvt. Ltd., HDFC Bank Ltd., ICICI Bank Ltd., Kotak Mahindra Bank Ltd., Meta Platforms Inc., One MobiKwik System Pvt. Ltd., One97 Communications Ltd., Reliance Industries Ltd., Samsung Electronics Co. Ltd., South Indian Bank Ltd., State Bank of India, Union Bank of India, Walmart Inc., and Yes Bank Market dynamics Parent market analysis, Market growth inducers and obstacles, Fast-growing and slow-growing segment analysis, COVID-19 impact and recovery analysis and future consumer dynamics, Market condition analysis for the forecast period. Customization purview If our report has not included the data that you are looking for, you can reach out to our analysts and get segments customized.

Table of Contents

1 Executive Summary

1.1 Market overview

2 Market Landscape

2.1 Market ecosystem

3 Market Sizing

3.1 Market definition

3.2 Market segment analysis

3.3 Market size 2021

3.4 Market outlook: Forecast for 2021-2026

4 Five Forces Analysis

4.1 Five forces summary

4.2 Bargaining power of buyers

4.3 Bargaining power of suppliers

4.4 Threat of new entrants

4.5 Threat of substitutes

4.6 Threat of rivalry

4.7 Market condition

5 Market Segmentation by Application

5.1 Market segments

5.2 Comparison by Application

5.3 Money transfers - Market size and forecast 2021-2026

5.4 Bill payments - Market size and forecast 2021-2026

5.5 Point of sale - Market size and forecast 2021-2026

5.6 Others - Market size and forecast 2021-2026

5.7 Market opportunity by Application

6 Market Segmentation by Type

6.1 Market segments

6.2 Comparison by Type

6.3 P2P - Market size and forecast 2021-2026

6.4 P2M - Market size and forecast 2021-2026

6.5 Market opportunity by Type

7 Customer Landscape

7.1 Customer landscape overview

8 Drivers, Challenges, and Trends

8.1 Market drivers

8.2 Market challenges

8.3 Impact of drivers and challenges

8.4 Market trends

9 Vendor Landscape

9.1 Overview

9.2 Vendor landscape

9.3 Landscape disruption

9.4 Industry risks

10 Vendor Analysis

10.1 Vendors covered

10.2 Market positioning of vendors

10.3 Alphabet Inc.

10.4 Amazon.com Inc.

10.5 Bharti Airtel Ltd.

10.6 Central Bank of India

10.7 Dreamplug Technologies Pvt. Ltd.

10.8 Meta Platforms Inc.

10.9 One97 Communications Ltd.

10.10 Samsung Electronics Co. Ltd.

10.11 Walmart Inc.

10.12 Yes Bank

11 Appendix

11.1 Scope of the report

11.2 Inclusions and exclusions checklist

11.3 Currency conversion rates for US$

11.4 Research methodology

11.5 List of abbreviations

About Us

Technavio is a leading global technology research and advisory company. Their research and analysis focus on emerging market trends and provide actionable insights to help businesses identify market opportunities and develop effective strategies to optimize their market positions. With over 500 specialized analysts, Technavio's report library consists of more than 17,000 reports and counting, covering 800 technologies, spanning 50 countries. Their client base consists of enterprises of all sizes, including more than 100 Fortune 500 companies. This growing client base relies on Technavio's comprehensive coverage, extensive research, and actionable market insights to identify opportunities in existing and potential markets and assess their competitive positions within changing market scenarios.

Contact

Technavio Research

Jesse Maida

Media & Marketing Executive

US: +1 844 364 1100

UK: +44 203 893 3200

Email: media@technavio.com

Website: www.technavio.com

Unified Payments Interface (UPI) Market in India

Cision

View original content to download multimedia:https://www.prnewswire.com/news-releases/unified-payments-interface-upi-market-size-in-india-to-grow-by-usd-65-49-trillion-from-2021-to-2026-instant-and-smooth-money-transfer-process-will-drive-growth---technavio-301894678.html

SOURCE Technavio"
