title,description,published date,url,source,news_website_url,full_article
"India may cross 10 billion UPI transactions in June: Here's a look at recent numbers, trends - CNBCTV18","India may cross 10 billion UPI transactions in June: Here's a look at recent numbers, trends  CNBCTV18","Mon, 12 Jun 2023 07:00:00 GMT",https://consent.google.com/m?continue=https://news.google.com/rss/articles/CBMingFodHRwczovL3d3dy5jbmJjdHYxOC5jb20vcGVyc29uYWwtZmluYW5jZS9pbmRpYS1tYXktY3Jvc3MtMTAtYmlsbGlvbi11cGktdHJhbnNhY3Rpb25zLWluLWp1bmUtZGlnaXRhbC1wYXltZW50cy1yaXNlLXJlYXNvbnMtdHJlbmRzLW51bWJlcnMtdm9sdW1lLTE2OTA2MTUxLmh0bdIBogFodHRwczovL3d3dy5jbmJjdHYxOC5jb20vcGVyc29uYWwtZmluYW5jZS9pbmRpYS1tYXktY3Jvc3MtMTAtYmlsbGlvbi11cGktdHJhbnNhY3Rpb25zLWluLWp1bmUtZGlnaXRhbC1wYXltZW50cy1yaXNlLXJlYXNvbnMtdHJlbmRzLW51bWJlcnMtdm9sdW1lLTE2OTA2MTUxLmh0bS9hbXA?oc%3D5&gl=FR&m=0&pc=n&cm=2&hl=en-US&src=1,CNBCTV18,https://www.cnbctv18.com,"India is expected to cross 10 billion Unified Payments Interface (UPI) transactions in June, experts told CNBC-TV18.com. This has happened due to the rapid digitisation of India's economy and the influence of technology in promoting financial inclusion, Subhrangshu Neogi, Executive Director & Co-Founder at Escrowpay said while speaking exclusively to CNBC-TV18.com.

Live TV

Loading...

Further, UPI transactions are expected to reach a milestone of 1 billion transactions per day by 2026-27, according to a report by PwC India titled ""The Indian Payments Handbook – 2022-27.” UPI. The report highlights that UPI is projected to dominate the retail digital payments landscape, accounting for 90 percent of the total transaction volume over the next five years.

What do numbers tell?

In May, UPI transactions already experienced remarkable growth, with a value of Rs 14.3 trillion and a volume of 9.41 billion. The transaction volume witnessed 58 percent increase compared to the same period in the previous financial year, while the transaction value rose by 37 percent.

The numbers for May are a significant uptick from April when the platform recorded 8.89 billion transactions.

In June, already in the first 10 days, India has crossed 3.2 billion transactions and it is expected that the country could be at the doorstep of 10 billion transactions in June, a News18 report also confirmed it.

If we look at yearly numbers, 45 billion UPI transactions were registered in FY 21-22, showing 8 times growth in the last 3 years and 50 times growth in the last 4 years, according to Press Information Bureau (PIB).

The month-wise data for the UPI transactions registered during the last year i.e 2022 is as under:

Month UPI Transactions Volume (In crore) Jan-22 461.715 Feb-22 452.749 Mar-22 540.565 Apr-22 558.305 May-22 595.52 Jun-22 586.275 Jul-22 628.84 Aug-22 657.963 Sep-22 678.08 Oct-22 730.542 Nov-22 730.945 Dec-22 782.949 Source-NPCI

The rise of UPI

UPI was introduced by the National Payments Corporation of India (NPCI) in 2016 as an interface that allows users to connect multiple bank accounts to a single mobile application and instantly transfer funds. This system ensures safe and convenient money transfers between bank accounts and operates under the strict supervision of the Reserve Bank of India (RBI) and NPCI.

It soon gained widespread acceptance among the masses as the most popular digital payment method. PhonePe, Google Pay, Paytm, and Cred account for over 95 percent of the market share. Among the various sectors, online retail leads the way, followed by food delivery and mobility (represents cab and

bike aggregators), according to a report by Redseer Strategy Consultants.

The report further projects that 85 percent of businesses in India will be digitally enabled by FY26. This means that a large majority of businesses in India will have embraced digital technologies and processes for their operations, whereas UPI will have a majority share.

Take a look at UPI transactions percentage and the growth:

Here's a percentage of transactional value by payment modes across sectors (FY23):

(Source: Redseer)

According to Satyajeet Kunjeer, Founder and CEO at Deciml, this widespread adoption of UPI in not just tier 1 cities but also tier 2 and 3 cities in just a matter of 7 years, coupled with the demand for UPI in other countries is a testament to it being one of the most advanced payment systems today.

""What’s equally interesting and important to note is that alongside making the ecosystem of transacting simpler and more convenient, UPI is also enabling multiple associated financial services such as expense tracking, budgeting, saving, investing and more,"" he told CNBC-TV18.com.

Anup Nayar, CEO-Domestic, In-Solutions Global believes that government initiatives like Digital India and the push towards a digital economy are the main reasons behind UPI's growth.

UPI helps businesses scale

The Redseer report, mentioned earlier, highlights these:

Low merchant discount rate (MDR): More than 50 percent of UPI transactions are person-to-merchant (P2M), which allows businesses to increase their profit margins compared to card transactions that charge 1.5-2 percent as transaction fees. P2M transactions have shown high growth and low MDR, making them an attractive business option.

Ease in overseas expansion: In October 2022, NPCI International Payments Limited (NIPL) partnered with Bhutan, Singapore, Malaysia, and other countries. This collaboration aims to assist businesses in expanding their consumer reach and increasing their revenue streams from international markets.

Ease in credit card transactions: Linking credit cards with UPI can boost sales as customers can easily purchase products and services on credit without the inconvenience of carrying physical cards.

Wider customer reach: Integrating UPI with feature phones can assist businesses in reaching customers across various city tiers.

Seamless payment experience with UPI Lite: Eliminating the need for customers to enter their PIN for every UPI payment can increase the frequency of small-ticket transactions (up to Rs 200) thereby leading to an increase in revenue generation through UPI."
Bahrain keen on UPI linkage for faster payments between countries - The Indian Express,Bahrain keen on UPI linkage for faster payments between countries  The Indian Express,"Mon, 20 Mar 2023 07:00:00 GMT",https://consent.google.com/m?continue=https://news.google.com/rss/articles/CBMiiQFodHRwczovL2luZGlhbmV4cHJlc3MuY29tL2FydGljbGUvYnVzaW5lc3MvYmFua2luZy1hbmQtZmluYW5jZS9iYWhyYWluLWtlZW4tb24tdXBpLWxpbmthZ2UtZm9yLWZhc3Rlci1wYXltZW50cy1iZXR3ZWVuLWNvdW50cmllcy04NTA1NTY2L9IBjgFodHRwczovL2luZGlhbmV4cHJlc3MuY29tL2FydGljbGUvYnVzaW5lc3MvYmFua2luZy1hbmQtZmluYW5jZS9iYWhyYWluLWtlZW4tb24tdXBpLWxpbmthZ2UtZm9yLWZhc3Rlci1wYXltZW50cy1iZXR3ZWVuLWNvdW50cmllcy04NTA1NTY2L2xpdGUv?oc%3D5&gl=FR&m=0&pc=n&cm=2&hl=en-US&src=1,The Indian Express,https://indianexpress.com,"After Singapore, Bahrain has evinced interest in India’s retail payment system and has held initial talks with the government for a possible collaboration. This is in line with the recent integration of India’s Unified Payment Interface (UPI) and Singapore’s PayNow payment system.

Last month, UPI and its equivalent network in Singapore, PayNow, were integrated to enable faster remittances between the citizens of the two countries at a highly competitive rate.

“It (UPI-PayNow linkage) is a good example. We have interest in it but we haven’t got to the stage of saying it would be done yet. But initial discussions have happened. I think we would be very interested in benefiting from the similar technology,” Bahrain’s Minister of Industry and Commerce Abdulla Adel Fakhro told The Indian Express.

Fakhro said during the discussion Indian government officials were very open to sharing their experience on the technology. QR code-based merchant payments through UPI apps are already enabled in Bhutan, Singapore and UAE.

Bahrain Economic Development Chief Executive Khalid Humaidan said financial services is an important sector for Bahrain and the country has identified opportunities in the financial services that it wants to focus on over the next few years.

“In our priority list, fintech is at the top. In the world of fintech, payment is very-very important. So, there are multiple conversations with multiple entities in the private and public sectors happening,” Humaidan said.

Fakhro, along with an over 60-member delegation, visited India last week to further increase cooperation and promote investments between the two countries.

Advertisement

“The purpose of the visit is to build and strengthen the relationship between Bahrain and India. Economically, socially and culturally we always had a very strong partnership,” Fakhro said.

In 2022, the bilateral trade between the two countries stood at $1.6 billion, including oil. The non-oil trade was $1.4 billion during the year.

“Hopefully in the next two-three years, I see it (India-Bahrain trades) going up to $2 billion,” Fakhro said.

Advertisement

From an investment perspective, Bahrain is looking at investments in all sectors but particularly in industries related to food, manufacturing, information and communications technology (ICT), downstream aluminium, petrochemicals, research and development, Fakhro said. There’s no income tax or corporate tax in Bahrain.

As of the third quarter of 2022, inward foreign direct investment (FDI) stocks of India to Bahrain reached $1.4 billion, accounting for around 4 per cent of Bahrain’s total FDI stock of $33.9 billion.

The Confederation of Indian Industry (CII) organised an interaction on accessing MENA opportunities via Bahrain in partnership with Bahrain’s Ministry of Industry and Commerce and its investment promotion agency Bahrain Economic Development Board."
Digital payments move beyond just scan to pay - Mint Lounge,Digital payments move beyond just scan to pay  Mint Lounge,"Mon, 28 Aug 2023 07:00:00 GMT",https://consent.google.com/m?continue=https://news.google.com/rss/articles/CBMidWh0dHBzOi8vbGlmZXN0eWxlLmxpdmVtaW50LmNvbS9zbWFydC1saXZpbmcvaW5ub3ZhdGlvbi91cGktZGlnaXRhbC1wYXltZW50cy1zY2FuLXRvLXBheS1xci1jb2Rlcy0xMTE2OTI5NTIyNzA3MDAuaHRtbNIBeWh0dHBzOi8vbGlmZXN0eWxlLmxpdmVtaW50LmNvbS9hbXAvc21hcnQtbGl2aW5nL2lubm92YXRpb24vdXBpLWRpZ2l0YWwtcGF5bWVudHMtc2Nhbi10by1wYXktcXItY29kZXMtMTExNjkyOTUyMjcwNzAwLmh0bWw?oc%3D5&gl=FR&m=0&pc=n&cm=2&hl=en-US&src=1,Mint Lounge,https://lifestyle.livemint.com,"Digital payments move beyond just scan to pay QR codes aren’t the only means to make digital payments. Here are some other ways to make the most of UPI apps /smart-living/innovation/upi-digital-payments-scan-to-pay-qr-codes-111692952270700.html 111692952270700 story

Scanning to pay remains the most popular way of making digital payments. But have you tried tap to pay? (iStockphoto)

India’s digital payment infrastructure was under the spotlight earlier this week, for all the good reasons. On 20 August, the German embassy in India posted a video on X (formerly Twitter) of Germany’s federal minister for digital affairs and transport, Volker Wissing, using the Unified Payments Interface (UPI) to make a payment at a vegetable stall in Delhi. The embassy described Wissing’s experience of using UPI payments as “fascinating”.

While seamless payments by simply scanning a QR code and entering a PIN aren’t entirely fascinating to us any more, it is true that India has seen a revolution in digital payments since 2016. This is largely owing to UPI, which facilitates inter-bank peer-to-peer (P2P) and person-to-merchant (P2M) transactions. It has been developed by the National Payments Corporation of India (NPCI), a not-for-profit owned by a consortium of major banks and promoted by the Reserve Bank of India (RBI), set up in 2008. Yes, unlike the general perception of it, UPI isn’t a “government service”.

UPI is considered one of the most successful payment systems in the world, in terms of the number of users, volume of transactions and number of transactions. In 2022, UPI enabled over 2,348 transactions every second. In July, there were a whopping 9.96 billion UPI transactions, with a value of ₹15.34 trillion, according to the NPCI.

Scanning to pay remains the most popular way of making digital payments as many people still haven’t tried the other ways one can pay via smartphones and/or the UPI apps. Here are some of the other ways to make digital payments.

Tap-to-Pay

What’s better than scan-to-pay? Tap-to-pay. NFC (near-field communication technology) payments are one of the most widely used payment methods outside India, though digital payments here have been driven by QR codes. That was also because most budget smartphones in India do not pack in NFC chips to cut costs, unlike the Western markets where most phones support NFC.

Now popular UPI apps like Google Pay and Paytm have enabled support for contactless NFC payments. The NFC chip on smartphones works like the chips found on credit and debit cards that support contactless payments. It saves one the hassle of turning on the phone, firing up the UPI app and scanning the QR code.

All you need to do is to tap the back of your smartphone on the payment terminal, or PoS. The transaction will be done automatically if the amount is less than ₹5,000. However, if the amount is more than ₹5,000, you will need to enter the PIN on your smartphone.

At the moment, only select Visa and Mastercard cards issued by certain banks are supported. Also, even though several premium smartwatches support tap-to-pay, you can’t make NFC payments via them in India since the UPI apps do not support those smartwatch platforms (although the Samsung Galaxy Watch 6 series launched this month does support tap-to-pay in India via Samsung Wallet).

UPI Lite

India’s tryst with digital payments began with mobile wallets. Paytm, Mobikwik, Freecharge and others were the first digital payment apps most of us used to make small-value transactions at merchants or to transfer money to friends and family.

Even now, some people use the digital wallet feature offered on UPI apps for quick transactions without the UPI PIN. UPI Lite, which takes forward that concept, is an on-device prepaid wallet where you don’t have to enter the PIN.

Most of the popular UPI apps like Google Pay, PhonePe and Paytm support UPI Lite. You just need to enable the feature and choose the primary bank account that will fund the wallet. UPI Lite works exactly like UPI and can be used to transfer money via UPI ID or phone number as well as make transactions via a QR code.

This wallet can be used for any UPI transaction with a value of less than ₹200 (the RBI has recently proposed raising the transaction limit to ₹500). The maximum balance you can keep in your UPI Lite wallet is ₹2,000, to contain the risks associated with the relaxation of two-factor authentication.

One of India’s success story is digital infrastructure. UPI enables everybody to make transactions in seconds. Millions of Indians use it. Federal Minister for Digital and Transport @Wissing was able to experience the simplicity of UPI payments first hand and is very fascinated! pic.twitter.com/I57P8snF0C — German Embassy India (@GermanyinIndia) August 20, 2023

RuPay

RuPay (a portmanteau of rupee and payment), a financial services and payments system conceived by the NPCI, facilitates electronic payment at all Indian banks and financial institutions.

Like Visa and Mastercard, several banks issue RuPay credit and debit cards to customers. You can link the RuPay credit cards to UPI apps and use the card for seamless UPI payments. Earlier, UPI payments were limited to bank accounts; with this new feature, RuPay credit cards can be used via UPI. Since the NPCI wants to push usage of RuPay, the feature isn’t available for credit cards issued by Visa and Mastercard.

While this offers the convenience of digital transactions without a physical card and at merchants which do not otherwise accept credit cards, it also gives people the option of using the credit facility while making UPI transactions instead of using funds from one’s bank account.

Tap-to-pay without UPI apps

While tap-to-pay transactions are limited to UPI apps, there’s a way to use credit or debit cards for payments without one as well. It’s not official, though.

Google Wallet is a mobile payments app that allows users to make payments both online and at physical stores. The app is not available in India (and you will have to sideload it using APK files) since Google offers Google Pay for the Indian market.

You can use Google Wallet, at your own discretion, to bypass UPI registration processes and set up Tap-to-Pay directly for your credit cards.

This works for any Android smartphone that supports NFC. That said, if you use, say, a Samsung smartphone, you could give this a skip since Samsung Pay offers similar functionality.

Digital Rupee

What’s next? Digital Rupee (e ₹), a tokenised digital version of the rupee, issued by the RBI. It’s essentially an electronic form of paper currency, not cryptocurrency. It’s virtual money regulated as legal tender, with no volatility. Its value remains the same, just like the value of physical cash. Like cash, you can transfer this digital money to family and friends and use it for merchant transactions using QR. Digital Rupee was launched last December and several public sector and private banks are participating in the pilot project.

Abhishek Baxi is a technology journalist and digital consultant.

Also read: From Microsoft to Google, there is AI in your productivity tools too"
UPI: How foreign nationals and NRIs visiting India can make payments using Unified Payments Interface - Zee Business,UPI: How foreign nationals and NRIs visiting India can make payments using Unified Payments Interface  Zee Business,"Tue, 01 Aug 2023 07:00:00 GMT",https://consent.google.com/m?continue=https://news.google.com/rss/articles/CBMimQFodHRwczovL3d3dy56ZWViaXouY29tL3BlcnNvbmFsLWZpbmFuY2UvbmV3cy11cGktaG93LWZvcmVpZ24tbmF0aW9uYWxzLW5yaXMtdmlzaXRpbmctaW5kaWEtY2FuLW1ha2UtcGF5bWVudHMtdXNpbmctdW5pZmllZC1wYXltZW50cy1pbnRlcmZhY2Utc3RzdC0yNDcwNjXSAZ0BaHR0cHM6Ly93d3cuemVlYml6LmNvbS9wZXJzb25hbC1maW5hbmNlL25ld3MtdXBpLWhvdy1mb3JlaWduLW5hdGlvbmFscy1ucmlzLXZpc2l0aW5nLWluZGlhLWNhbi1tYWtlLXBheW1lbnRzLXVzaW5nLXVuaWZpZWQtcGF5bWVudHMtaW50ZXJmYWNlLXN0c3QtMjQ3MDY1L2FtcA?oc%3D5&gl=FR&m=0&pc=n&cm=2&hl=en-US&src=1,Zee Business,https://www.zeebiz.com,"The Reserve Bank of India had issued a circular in February this year, allowing access to Unified Payments Interface (UPI) to Non Resident Indians (NRIs) and foreign nationals visiting India. The central bank has made changes to its Master Directions on Prepaid Payment Instruments (PPIs) accordingly. Dr Bhagwat Kisanrao Karad, Union Minister of State for Finance, explained the details in reply to a question in the Lok Sabha on July 31.

UPI for foreign nationals, NRIs visiting India

The UPI facility has been extended to travellers from G-20 countries at the Mumbai, Bengaluru, Mumbai and New Delhi international airports for merchant payments. Later, it will be extended across all entry points in India.

The RBI has made a provision to provide UPI access to NRIs who have international mobile numbers linked to their non-resident ordinary (NRO) or non-resident external (NRE) accounts. The National Payments Corporation of India (NPCI), the agency that manages the UPI system, has stated that the facility is available for 10 regions- Australia, Saudi Arabia, Hong Kong, Singapore, Canada, Qatar, Oman, United States, the UAE and the United Kingdom. Earlier, the facility was available only to foreign travellers or NRIs who had Indian mobile numbers.

How foreign nationals, NRIs can use UPI

The users should link their mobile number with an NRO/NRE account. The member bank whose account will be linked by the customer must keep in mind that the required Know Your Customer process (KYC) is done as per Indian laws, including the Foreign Exchange Management (FEMA) Act.

The Prepaid Payment Instruments (PPIs) guidelines by the RBI state that the PPIs can be issued in co-branding arrangement with entities/institutions which are authorised to deal in foreign exchange under FEMA. The PPIs can be used for merchant transactions only. Loading or reloading of such payment instruments will be against receipt of foreign exchange by any payment instrument or cash. The unutilised balances can be transferred “back to source” or encashed in foreign currency.

What the RBI has said on UPI transactions

The Reserve Bank of India has allowed UPI transactions for travellers from G20 countries. The G20 or Group of 20 comprises Argentina, Brazil, Australia, Canada, Germany, China, France, India, the Republic of Korea, Indonesia, Italy, the US, Japan, Mexico, Russia, Saudi Arabia, the UK, South Africa, Turkey, and the European Union (EU). The move to enable UPI transactions for G20 tourists has been taken during India’s presidency in the group.

Volume of UPI transactions over the years

UPI transactions in India have seen an exponential rise in value, from 5.86 lakh crore in 2018 to 125.94 lakh crore in 2022. From January to June 2023, the value of the transactions was Rs 83.20 lakh crore. Other countries have started accepting UPI payments since last year."
UPI set to reach $1T in merchant payment transactions by 2026 - YourStory,UPI set to reach $1T in merchant payment transactions by 2026  YourStory,"Thu, 04 May 2023 07:00:00 GMT",https://consent.google.com/m?continue=https://news.google.com/rss/articles/CBMiUWh0dHBzOi8veW91cnN0b3J5LmNvbS8yMDIzLzA1L3VwaS1zZXQtdG8tcmVhY2gtMS10cmlsbGlvbi1pbi10cmFuc2FjdGlvbnMtYnktMjAyNtIBAA?oc%3D5&gl=FR&m=0&pc=n&cm=2&hl=en-US&src=1,YourStory,https://yourstory.com,
